{
  "id": "remka-pro",
  "created_at": "2026-03-17T12:00:00Z",
  "expanded_at": "2026-03-17T12:05:00Z",
  "status": "expanded",
  "brief_version": 1,

  "brand": {
    "name": "RemkaPro",
    "headline": "Ремонт побутової техніки за 2 години",
    "subheadline": "Виїзд, діагностика, гарантія 2 роки. Дніпро і область.",
    "slogan": "Працює як нова",
    "positioning": "Швидкий і надійний сервіс з прозорим ціноутворенням для людей, які цінують свій час",
    "key_message": "Ми приїдемо за 2 години, безкоштовно продіагностуємо і відремонтуємо з гарантією. Ніяких прихованих доплат.",
    "location": "Дніпро"
  },

  "services": [
    {
      "name": "Ремонт пральних машин",
      "icon": "WashingMachine",
      "short_description": "Усунемо будь-яку несправність за один візит",
      "long_description": "Ремонтуємо всі марки та моделі пральних машин. Діагностика безкоштовна, запчастини в наявності, гарантія 2 роки на роботу і деталі.",
      "cta": "Викликати майстра"
    },
    {
      "name": "Ремонт холодильників",
      "icon": "Refrigerator",
      "short_description": "Терміновий ремонт в день звернення",
      "long_description": "Від простої заміни термостата до складного ремонту компресора. Працюємо з усіма марками, маємо запчастини на складі.",
      "cta": "Викликати майстра"
    },
    {
      "name": "Ремонт бойлерів",
      "icon": "Flame",
      "short_description": "Повернемо гарячу воду за кілька годин",
      "long_description": "Чистка, заміна ТЕНів, ремонт електроніки. Працюємо з електричними та газовими бойлерами всіх виробників.",
      "cta": "Викликати майстра"
    }
  ],

  "advantages": [
    {
      "title": "Виїзд за 2 години",
      "description": "Майстер приїде у зручний для вас час. Середній час очікування — 1.5 години по Дніпру.",
      "icon": "Clock"
    },
    {
      "title": "Безкоштовна діагностика",
      "description": "Визначимо причину поломки безкоштовно. Якщо відмовитесь від ремонту — платити нічого.",
      "icon": "Search"
    },
    {
      "title": "Гарантія 2 роки",
      "description": "На всі роботи та встановлені запчастини. Якщо поломка повториться — виправимо безкоштовно.",
      "icon": "Shield"
    },
    {
      "title": "Прозорі ціни",
      "description": "Називаємо точну вартість після діагностики, до початку ремонту. Ніяких доплат по факту.",
      "icon": "Receipt"
    }
  ],

  "audience": {
    "avatars": [
      {
        "name": "Олена",
        "age": 38,
        "situation": "Працююча мама двох дітей, зламалась пральна машина в суботу вранці. Гора білизни, потрібен ремонт сьогодні.",
        "looking_for": "Швидкий виїзд, нормальна ціна, щоб не треба було брати відгул",
        "fears": "Що скажуть одну ціну по телефону, а на місці назвуть іншу. Що затягнуть ремонт на тиждень.",
        "purchase_trigger": "Обіцянка виїзду сьогодні + безкоштовна діагностика знімає ризик"
      },
      {
        "name": "Андрій",
        "age": 52,
        "situation": "Зламався холодильник, продукти псуються. Дружина просить терміново вирішити.",
        "looking_for": "Надійний майстер з досвідом, не студент з YouTube",
        "fears": "Що поставлять неякісну запчастину і через місяць зламається знову",
        "purchase_trigger": "Гарантія 2 роки + відгуки реальних людей"
      }
    ],
    "objections": [
      {
        "objection": "А скільки коштує?",
        "answer": "Точну ціну називаємо після безкоштовної діагностики, до початку ремонту. Середній чек — 800-2500 грн залежно від поломки."
      },
      {
        "objection": "А може простіше купити нову?",
        "answer": "Ремонт в 3-5 разів дешевше за нову техніку. Майстер порадить чесно — якщо ремонт невигідний, ми скажемо."
      },
      {
        "objection": "А ви точно приїдете сьогодні?",
        "answer": "Так, середній час виїзду — 1.5 години. Якщо не зможемо сьогодні — скажемо одразу по телефону."
      }
    ]
  },

  "pages": [
    {
      "slug": "home",
      "name": "Головна",
      "purpose": "Конвертувати відвідувача в заявку. Показати що ми швидкі, надійні, з гарантією.",
      "sections": [
        {
          "type": "hero",
          "purpose": "За 3 секунди пояснити хто ми і чому обрати нас",
          "content": {
            "headline": "Ремонт побутової техніки за 2 години",
            "subheadline": "Виїзд, діагностика, гарантія 2 роки. Дніпро і область.",
            "cta_primary": "Викликати майстра",
            "cta_secondary": "Дізнатись вартість",
            "trust_line": "4.9★ на Google · 1200+ відремонтованих приладів"
          }
        },
        {
          "type": "advantages",
          "purpose": "Закрити головні сумніви відвідувача",
          "content": {
            "items": [
              {
                "title": "Виїзд за 2 години",
                "description": "Майстер приїде у зручний для вас час. Середній час очікування — 1.5 години по Дніпру.",
                "icon": "Clock"
              },
              {
                "title": "Безкоштовна діагностика",
                "description": "Визначимо причину поломки безкоштовно. Якщо відмовитесь від ремонту — платити нічого.",
                "icon": "Search"
              },
              {
                "title": "Гарантія 2 роки",
                "description": "На всі роботи та встановлені запчастини. Якщо поломка повториться — виправимо безкоштовно.",
                "icon": "Shield"
              },
              {
                "title": "Прозорі ціни",
                "description": "Називаємо точну вартість після діагностики, до початку ремонту. Ніяких доплат по факту.",
                "icon": "Receipt"
              }
            ]
          }
        },
        {
          "type": "services",
          "purpose": "Показати що ремонтуємо саме те, що зламалось у відвідувача",
          "content": {
            "items": [
              {
                "name": "Ремонт пральних машин",
                "icon": "WashingMachine",
                "short_description": "Усунемо будь-яку несправність за один візит",
                "cta": "Викликати майстра"
              },
              {
                "name": "Ремонт холодильників",
                "icon": "Refrigerator",
                "short_description": "Терміновий ремонт в день звернення",
                "cta": "Викликати майстра"
              },
              {
                "name": "Ремонт бойлерів",
                "icon": "Flame",
                "short_description": "Повернемо гарячу воду за кілька годин",
                "cta": "Викликати майстра"
              }
            ]
          }
        },
        {
          "type": "how_it_works",
          "purpose": "Зняти страх невідомості — показати простий процес",
          "content": {
            "steps": [
              {"step": 1, "title": "Залишаєте заявку", "description": "По телефону або на сайті. Описуєте проблему."},
              {"step": 2, "title": "Майстер приїжджає", "description": "Протягом 2 годин. Діагностика безкоштовна."},
              {"step": 3, "title": "Ремонт на місці", "description": "Називаємо ціну. Ремонтуємо одразу або привозимо запчастину."},
              {"step": 4, "title": "Гарантія 2 роки", "description": "Видаємо гарантійний талон. Будь-які питання — телефонуйте."}
            ]
          }
        },
        {
          "type": "testimonials",
          "purpose": "Соціальний доказ — реальні відгуки знімають сумніви",
          "content": {
            "items": [
              {
                "name": "Марина К.",
                "text": "Зламалась пральна машина в неділю. Зателефонувала — майстер приїхав через годину. Замінив підшипник, все працює. Дуже вдячна!",
                "rating": 5
              },
              {
                "name": "Олег В.",
                "text": "Холодильник перестав морозити. Думав доведеться купувати новий. Хлопці приїхали, замінили компресор — вже пів року працює ідеально.",
                "rating": 5
              },
              {
                "name": "Тетяна М.",
                "text": "Подобається що одразу кажуть ціну. Ніяких сюрпризів. Ремонтували бойлер — все чітко і з гарантією.",
                "rating": 5
              }
            ]
          }
        },
        {
          "type": "pricing",
          "purpose": "Прозорість цін — головне заперечення",
          "content": {
            "note": "Прайс-лист по видах техніки з діапазонами цін",
            "items": [
              {"service": "Ремонт пральних машин", "price_range": "від 800 грн"},
              {"service": "Ремонт холодильників", "price_range": "від 1000 грн"},
              {"service": "Ремонт бойлерів", "price_range": "від 600 грн"}
            ]
          }
        },
        {
          "type": "faq",
          "purpose": "Закрити залишкові заперечення",
          "content": {
            "items": [
              {
                "question": "А скільки коштує ремонт?",
                "answer": "Точну ціну називаємо після безкоштовної діагностики, до початку ремонту. Середній чек — 800-2500 грн залежно від поломки."
              },
              {
                "question": "А може простіше купити нову техніку?",
                "answer": "Ремонт в 3-5 разів дешевше за нову техніку. Майстер порадить чесно — якщо ремонт невигідний, ми скажемо."
              },
              {
                "question": "А ви точно приїдете сьогодні?",
                "answer": "Так, середній час виїзду — 1.5 години. Якщо не зможемо сьогодні — скажемо одразу по телефону."
              },
              {
                "question": "Які марки техніки ви ремонтуєте?",
                "answer": "Всі марки без винятку — від бюджетних до преміальних. Маємо досвід з Samsung, LG, Bosch, Electrolux та іншими."
              },
              {
                "question": "Чи є гарантія на запчастини?",